{
  "components": {
    "container": {
      "command": "scripts/ci.py verification-container",
      "environment_dimensions": ["architecture", "django", "operating_system", "python", "runner_image", "uv"],
      "relevant_patterns": ["Dockerfile", "Makefile", "scripts/ci.py", "deploy/**", "website/**", "scripts/verify_static_manifest.py", "pyproject.toml", "uv.lock", ".python-version"],
      "validity_class": "volatile"
    },
    "django": {
      "command": "scripts/ci.py test-django-full",
      "environment_dimensions": ["allowlisted_config", "architecture", "database", "django", "operating_system", "python", "runner_image", "uv"],
      "relevant_patterns": ["accounts/**", "accounts_ext/**", "api/**", "cadmin/**", "content/**", "content_sync/**", "core/**", "course_management/**", "course_platform_templates/**", "courses/**", "events/**", "management_api/**", "management_auth/**", "review_import/**", "studio/**", "studio_courses/**", "website/**", "templates/**", "ci/**", "tests_ci/**", ".github/workflows/**", "**/fixtures/**", "pyproject.toml", "uv.lock", "manage.py", "Makefile", "scripts/ci.py"],
      "validity_class": "standard"
    },
    "evidence_validation": {
      "command": "scripts/ci.py test-ci",
      "environment_dimensions": ["architecture", "django", "operating_system", "python", "runner_image", "uv"],
      "relevant_patterns": ["ci/**", "tests_ci/**", ".github/workflows/**", "Makefile", "scripts/ci.py"],
      "validity_class": "standard"
    },
    "playwright": {
      "command": "scripts/ci.py test-playwright",
      "environment_dimensions": ["allowlisted_config", "architecture", "browser", "django", "operating_system", "playwright", "python", "runner_image", "uv"],
      "relevant_patterns": ["playwright_tests/**", "**/templates/**", "**/static/**", "**/views.py", "**/urls.py", "**/context_processors.py", "**/serializers.py", "**/fixtures/**", "pyproject.toml", "uv.lock"],
      "validity_class": "volatile"
    },
    "quality": {
      "command": "quality-contract-v3",
      "environment_dimensions": ["architecture", "django", "operating_system", "python", "runner_image", "uv"],
      "relevant_patterns": ["**/*.py", "ci/**", "tests_ci/**", ".github/workflows/**", "Makefile", "scripts/ci.py", "pyproject.toml", "uv.lock", ".python-version", "manage.py"],
      "validity_class": "standard"
    },
    "screenshots": {
      "command": "independent tester desktop/mobile capture and inspection",
      "environment_dimensions": ["allowlisted_config", "architecture", "browser", "django", "operating_system", "playwright", "python", "runner_image", "uv"],
      "relevant_patterns": ["playwright_tests/**", "**/templates/**", "**/static/**", "**/views.py", "**/urls.py", "**/context_processors.py", "**/serializers.py", "**/fixtures/**"],
      "validity_class": "visual"
    },
    "selector": {
      "command": "scripts/ci.py verification-plan",
      "environment_dimensions": ["architecture", "django", "operating_system", "python", "runner_image", "uv"],
      "relevant_patterns": ["ci/**", "tests_ci/**", ".github/workflows/**", "Makefile", "scripts/ci.py"],
      "validity_class": "standard"
    }
  },
  "nodes": [
    {"id":"app.api","kind":"owner","prefixes":["api/"],"exact":[],"downstream":["django.api"],"components":["container","django","playwright","quality"],"environment_dimensions":["architecture","database","django","operating_system","python","runner_image","uv"],"validity_class":"standard","risk_flags":[],"render_flags":[]},
    {"id":"app.studio_courses","kind":"owner","prefixes":["studio_courses/"],"exact":[],"downstream":["django.studio","django.studio_courses"],"components":["container","django","playwright","quality"],"environment_dimensions":["architecture","database","django","operating_system","python","runner_image","uv"],"validity_class":"standard","risk_flags":[],"render_flags":[]},
    {"id":"app.content","kind":"owner","prefixes":["content/"],"exact":[],"downstream":["django.accounts","django.api","django.content","django.content_sync","django.core","django.courses","django.events"],"components":["container","django","playwright","quality"],"environment_dimensions":["architecture","database","django","operating_system","python","runner_image","uv"],"validity_class":"standard","risk_flags":[],"render_flags":[]},
    {"id":"app.courses","kind":"owner","prefixes":["courses/"],"exact":[],"downstream":["django.accounts","django.api","django.content","django.content_sync","django.core","django.courses","django.management_api","django.studio","django.studio_courses"],"components":["container","django","playwright","quality"],"environment_dimensions":["architecture","database","django","operating_system","python","runner_image","uv"],"validity_class":"standard","risk_flags":[],"render_flags":[]},
    {"id":"app.management_api","kind":"owner","prefixes":["management_api/"],"exact":[],"downstream":["django.api","django.management_api","django.studio"],"components":["container","django","playwright","quality"],"environment_dimensions":["architecture","database","django","operating_system","python","runner_image","uv"],"validity_class":"standard","risk_flags":[],"render_flags":[]},
    {"id":"app.management_auth","kind":"owner","prefixes":["management_auth/"],"exact":[],"downstream":["django.accounts","django.api","django.core","django.management_api","django.management_auth","django.studio"],"components":["container","django","playwright","quality"],"environment_dimensions":["architecture","database","django","operating_system","python","runner_image","uv"],"validity_class":"standard","risk_flags":[],"render_flags":[]},
    {"id":"app.review_import","kind":"owner","prefixes":["review_import/"],"exact":[],"downstream":["django.accounts","django.courses","django.review_import"],"components":["container","django","playwright","quality"],"environment_dimensions":["architecture","database","django","operating_system","python","runner_image","uv"],"validity_class":"standard","risk_flags":[],"render_flags":[]},
    {"id":"app.studio","kind":"owner","prefixes":["studio/"],"exact":[],"downstream":["django.accounts","django.core","django.events","django.studio"],"components":["container","django","playwright","quality"],"environment_dimensions":["architecture","database","django","operating_system","python","runner_image","uv"],"validity_class":"standard","risk_flags":[],"render_flags":[]},

    {"id":"shared.accounts","kind":"owner","prefixes":["accounts/"],"exact":[],"downstream":[],"components":["container","django","playwright","quality"],"environment_dimensions":["architecture","database","django","operating_system","python","runner_image","uv"],"validity_class":"standard","risk_flags":["shared_runtime","auth_security_privacy"],"render_flags":[]},
    {"id":"shared.accounts_ext","kind":"owner","prefixes":["accounts_ext/"],"exact":[],"downstream":[],"components":["container","django","playwright","quality"],"environment_dimensions":["architecture","database","django","operating_system","python","runner_image","uv"],"validity_class":"standard","risk_flags":["shared_runtime","auth_security_privacy"],"render_flags":[]},
    {"id":"shared.core","kind":"owner","prefixes":["core/"],"exact":["management_registry.py"],"downstream":[],"components":["container","django","playwright","quality"],"environment_dimensions":["architecture","database","django","operating_system","python","runner_image","uv"],"validity_class":"standard","risk_flags":["shared_runtime"],"render_flags":[]},
    {"id":"shared.content_sync","kind":"owner","prefixes":["content_sync/"],"exact":[],"downstream":[],"components":["container","django","playwright","quality"],"environment_dimensions":["architecture","database","django","operating_system","python","runner_image","uv"],"validity_class":"standard","risk_flags":["shared_runtime"],"render_flags":[]},
    {"id":"shared.email_templates","kind":"owner","prefixes":["email_templates/"],"exact":[],"downstream":[],"components":["container","django","playwright","quality"],"environment_dimensions":["architecture","database","django","operating_system","python","runner_image","uv"],"validity_class":"standard","risk_flags":["shared_runtime","auth_security_privacy"],"render_flags":[]},
    {"id":"shared.events","kind":"owner","prefixes":["event_qna/","event_registrants/","events/"],"exact":[],"downstream":[],"components":["container","django","playwright","quality"],"environment_dimensions":["architecture","database","django","operating_system","python","runner_image","uv"],"validity_class":"standard","risk_flags":["shared_runtime"],"render_flags":[]},

    {"id":"surface.website","kind":"owner","prefixes":["website/"],"exact":[],"downstream":[],"components":["container","django","playwright","quality"],"environment_dimensions":["architecture","database","django","operating_system","python","runner_image","uv"],"validity_class":"volatile","risk_flags":["shared_runtime","deployment_runtime"],"render_flags":[]},
    {"id":"surface.course_management","kind":"owner","prefixes":["course_management/"],"exact":[],"downstream":[],"components":["container","django","playwright","quality"],"environment_dimensions":["architecture","database","django","operating_system","python","runner_image","uv"],"validity_class":"standard","risk_flags":["shared_runtime"],"render_flags":[]},
    {"id":"surface.cadmin","kind":"owner","prefixes":["cadmin/"],"exact":[],"downstream":[],"components":["container","django","playwright","quality"],"environment_dimensions":["architecture","database","django","operating_system","python","runner_image","uv"],"validity_class":"standard","risk_flags":["compatibility_contract"],"render_flags":[]},